[
  {
    "stableId": "UT-001",
    "testMethod": "Quantity_CreateFractionalOptionContracts_IsRejected",
    "expectedAssertion": "Option quantities cannot be fractional.",
    "productionTarget": "Contract",
    "fixtureIds": [],
    "initialStatus": "NOT_IMPLEMENTED",
    "initialEvidenceQuality": "placeholder",
    "remediationStatus": "IMPLEMENTED_WORKTREE"
  },
  {
    "stableId": "UT-002",
    "testMethod": "Coverage_FromFractionalShares_CountsOnlyCompleteHundreds",
    "expectedAssertion": "`99.999` yields zero blocks; `100.999` yields one.",
    "productionTarget": "Contract",
    "fixtureIds": [],
    "initialStatus": "NOT_IMPLEMENTED",
    "initialEvidenceQuality": "placeholder",
    "remediationStatus": "IMPLEMENTED_WORKTREE"
  },
  {
    "stableId": "UT-003",
    "testMethod": "OptionalValue_UnknownInvalidUnavailableAndZero_RemainDistinct",
    "expectedAssertion": "Four states survive mapping and JSON round-trip without coercion.",
    "productionTarget": "Contract",
    "fixtureIds": [],
    "initialStatus": "NOT_IMPLEMENTED",
    "initialEvidenceQuality": "placeholder",
    "remediationStatus": "IMPLEMENTED_WORKTREE"
  },
  {
    "stableId": "UT-004",
    "testMethod": "Money_RoundAtDeclaredBoundary_UsesConfiguredRuleOnce",
    "expectedAssertion": "Money is rounded exactly once at the declared boundary.",
    "productionTarget": "Contract",
    "fixtureIds": [],
    "initialStatus": "NOT_IMPLEMENTED",
    "initialEvidenceQuality": "placeholder",
    "remediationStatus": "IMPLEMENTED_WORKTREE"
  },
  {
    "stableId": "UT-005",
    "testMethod": "Ratio_DivideByZero_ReturnsInvalidNotInfinity",
    "expectedAssertion": "Invalid arithmetic cannot become a rankable value.",
    "productionTarget": "Contract",
    "fixtureIds": [],
    "initialStatus": "NOT_IMPLEMENTED",
    "initialEvidenceQuality": "placeholder",
    "remediationStatus": "IMPLEMENTED_WORKTREE"
  },
  {
    "stableId": "UT-006",
    "testMethod": "ContractSchema_UnknownProperty_IsRejected",
    "expectedAssertion": "`additionalProperties: false` is enforced.",
    "productionTarget": "Contract",
    "fixtureIds": [],
    "initialStatus": "NOT_IMPLEMENTED",
    "initialEvidenceQuality": "placeholder",
    "remediationStatus": "IMPLEMENTED_WORKTREE"
  },
  {
    "stableId": "UT-007",
    "testMethod": "ContractSchema_MissingRequiredProperty_IsRejected",
    "expectedAssertion": "Missingness is not filled with a default.",
    "productionTarget": "Contract",
    "fixtureIds": [],
    "initialStatus": "NOT_IMPLEMENTED",
    "initialEvidenceQuality": "placeholder",
    "remediationStatus": "IMPLEMENTED_WORKTREE"
  },
  {
    "stableId": "UT-008",
    "testMethod": "ContractSchema_UnknownEnumValue_IsRejectedOrMigratedExplicitly",
    "expectedAssertion": "No permissive enum fallback enters Domain.",
    "productionTarget": "Contract",
    "fixtureIds": [],
    "initialStatus": "NOT_IMPLEMENTED",
    "initialEvidenceQuality": "placeholder",
    "remediationStatus": "IMPLEMENTED_WORKTREE"
  },
  {
    "stableId": "UT-009",
    "testMethod": "CanonicalHasher_PropertyAndDictionaryOrderVaries_HashIsStable",
    "expectedAssertion": "Semantically identical records produce the same hash.",
    "productionTarget": "Contract",
    "fixtureIds": [],
    "initialStatus": "NOT_IMPLEMENTED",
    "initialEvidenceQuality": "placeholder",
    "remediationStatus": "IMPLEMENTED_WORKTREE"
  },
  {
    "stableId": "UT-010",
    "testMethod": "CanonicalHasher_MaterialValueChanges_HashChanges",
    "expectedAssertion": "Any executable or approval-bound value changes identity.",
    "productionTarget": "Contract",
    "fixtureIds": [],
    "initialStatus": "NOT_IMPLEMENTED",
    "initialEvidenceQuality": "placeholder",
    "remediationStatus": "IMPLEMENTED_WORKTREE"
  },
  {
    "stableId": "UT-011",
    "testMethod": "DecisionTime_ParseDifferentOffsets_RepresentsSameInstant",
    "expectedAssertion": "Offset-equivalent timestamps normalize to one UTC instant.",
    "productionTarget": "Contract",
    "fixtureIds": [],
    "initialStatus": "NOT_IMPLEMENTED",
    "initialEvidenceQuality": "placeholder",
    "remediationStatus": "IMPLEMENTED_WORKTREE"
  },
  {
    "stableId": "UT-012",
    "testMethod": "PersistedContract_OlderSupportedVersion_UsesExplicitMigrator",
    "expectedAssertion": "Supported old data is migrated deliberately; unsupported versions fail visibly.",
    "productionTarget": "Contract",
    "fixtureIds": [],
    "initialStatus": "NOT_IMPLEMENTED",
    "initialEvidenceQuality": "placeholder",
    "remediationStatus": "IMPLEMENTED_WORKTREE"
  },
  {
    "stableId": "UT-020",
    "testMethod": "PortfolioEligibility_TransitionMatrix_AllDeclaredTransitionsMatchSpecification",
    "expectedAssertion": "Theory covers every allowed source/event/target triple.",
    "productionTarget": "StateMachine",
    "fixtureIds": [],
    "initialStatus": "NOT_IMPLEMENTED",
    "initialEvidenceQuality": "placeholder",
    "remediationStatus": "IMPLEMENTED_WORKTREE"
  },
  {
    "stableId": "UT-021",
    "testMethod": "PortfolioEligibility_InvalidTransition_EntersSafeHaltWithoutMutation",
    "expectedAssertion": "Invalid transitions do not invent an eligible state.",
    "productionTarget": "StateMachine",
    "fixtureIds": [],
    "initialStatus": "NOT_IMPLEMENTED",
    "initialEvidenceQuality": "placeholder",
    "remediationStatus": "IMPLEMENTED_WORKTREE"
  },
  {
    "stableId": "UT-022",
    "testMethod": "OrderState_TransitionMatrix_AllBrokerStatusesNormalizeDeterministically",
    "expectedAssertion": "Covers `accepted`, `pending_new`, `new`, `held`, `accepted_for_bidding`, `partially_filled`, `done_for_day`, `pending_cancel`, `pending_replace`, `stopped`, `suspended`, `calculated`, `filled`, `canceled`, `expired`, `rejected`, and `replaced`.",
    "productionTarget": "StateMachine",
    "fixtureIds": [],
    "initialStatus": "NOT_IMPLEMENTED",
    "initialEvidenceQuality": "placeholder",
    "remediationStatus": "IMPLEMENTED_WORKTREE"
  },
  {
    "stableId": "UT-023",
    "testMethod": "OrderState_UnknownBrokerStatus_RequiresReconciliation",
    "expectedAssertion": "Future/unknown values fail closed rather than being treated as terminal.",
    "productionTarget": "StateMachine",
    "fixtureIds": [],
    "initialStatus": "NOT_IMPLEMENTED",
    "initialEvidenceQuality": "placeholder",
    "remediationStatus": "IMPLEMENTED_WORKTREE"
  },
  {
    "stableId": "UT-024",
    "testMethod": "OrderState_TerminalObservationFollowedByOlderEvent_DoesNotRegress",
    "expectedAssertion": "Out-of-order observations cannot reopen a terminal order.",
    "productionTarget": "StateMachine",
    "fixtureIds": [],
    "initialStatus": "NOT_IMPLEMENTED",
    "initialEvidenceQuality": "placeholder",
    "remediationStatus": "IMPLEMENTED_WORKTREE"
  },
  {
    "stableId": "UT-025",
    "testMethod": "OrderState_TradeCorrectionOrBust_RecomputesCumulativeFill",
    "expectedAssertion": "Corrected/busted activity changes derived fill state through a new observation.",
    "productionTarget": "StateMachine",
    "fixtureIds": [],
    "initialStatus": "NOT_IMPLEMENTED",
    "initialEvidenceQuality": "placeholder",
    "remediationStatus": "IMPLEMENTED_WORKTREE"
  },
  {
    "stableId": "UT-026",
    "testMethod": "OptionLifecycle_TransitionMatrix_AllDeclaredTransitionsMatchSpecification",
    "expectedAssertion": "Every declared lifecycle event has one next state and next action.",
    "productionTarget": "StateMachine",
    "fixtureIds": [],
    "initialStatus": "NOT_IMPLEMENTED",
    "initialEvidenceQuality": "placeholder",
    "remediationStatus": "IMPLEMENTED_WORKTREE"
  },
  {
    "stableId": "UT-027",
    "testMethod": "OptionLifecycle_AssignmentObservedAtAnyAge_EntersAssignedPendingReconciliation",
    "expectedAssertion": "Early assignment is accepted on any open-date state, not only expiry day.",
    "productionTarget": "StateMachine",
    "fixtureIds": [],
    "initialStatus": "NOT_IMPLEMENTED",
    "initialEvidenceQuality": "placeholder",
    "remediationStatus": "IMPLEMENTED_WORKTREE"
  },
  {
    "stableId": "UT-028",
    "testMethod": "OptionLifecycle_ExpiryQuoteSeenWithoutBrokerConfirmation_RemainsPending",
    "expectedAssertion": "A quote cannot release the obligation.",
    "productionTarget": "StateMachine",
    "fixtureIds": [],
    "initialStatus": "NOT_IMPLEMENTED",
    "initialEvidenceQuality": "placeholder",
    "remediationStatus": "IMPLEMENTED_WORKTREE"
  },
  {
    "stableId": "UT-029",
    "testMethod": "OptionLifecycle_CloseFillConfirmed_ReleasesOnlyClosedQuantity",
    "expectedAssertion": "Partial close retains the remaining obligation.",
    "productionTarget": "StateMachine",
    "fixtureIds": [],
    "initialStatus": "NOT_IMPLEMENTED",
    "initialEvidenceQuality": "placeholder",
    "remediationStatus": "IMPLEMENTED_WORKTREE"
  },
  {
    "stableId": "UT-030",
    "testMethod": "TerminalWorkflowCycle_AnyFurtherAdvance_IsRejected",
    "expectedAssertion": "Completed, no-action, safely-deferred, and failed cycles are immutable.",
    "productionTarget": "StateMachine",
    "fixtureIds": [],
    "initialStatus": "NOT_IMPLEMENTED",
    "initialEvidenceQuality": "placeholder",
    "remediationStatus": "IMPLEMENTED_WORKTREE"
  },
  {
    "stableId": "UT-031",
    "testMethod": "Lifecycle_RollRequestedInMvp_IsRejectedAsOutOfScope",
    "expectedAssertion": "No close, entry, intent, or broker write is created by an MVP roll request.",
    "productionTarget": "StateMachine",
    "fixtureIds": [],
    "initialStatus": "NOT_IMPLEMENTED",
    "initialEvidenceQuality": "placeholder",
    "remediationStatus": "IMPLEMENTED_WORKTREE"
  },
  {
    "stableId": "UT-032",
    "testMethod": "StateTransition_DuplicateEvent_IsIdempotent",
    "expectedAssertion": "Reprocessing an identical event produces no second effect.",
    "productionTarget": "StateMachine",
    "fixtureIds": [],
    "initialStatus": "NOT_IMPLEMENTED",